corp_id,corp_name,in_stlmt_tot,res_nrl,public_xfr_in,public_xfr_out,net_pub_xfr,xfr_ch_schlsp_out,net_xfr,xfr_out_tot,xfr_out_tot_rate,xfr_in_rate,pr_xfr_out_rate,net_xfr_rate,yr
0395,Benton Community School Corp,1767,1557,66,145,-79,65,-144,210,12,4,4,-8,2021-08-01
0515,Blackford County Schools,1721,1480,32,237,-205,4,-209,241,14,2,0,-12,2021-08-01
0615,Western Boone Co Com Sch Dist,1537,1435,201,92,109,10,99,102,7,13,1,6,2021-08-01
0630,Zionsville Community Schools,7378,7230,45,113,-68,35,-103,148,2,1,0,-1,2021-08-01
0665,Lebanon Community School Corp,3511,3182,84,266,-182,63,-245,329,9,2,2,-7,2021-08-01
0670,Brown County School Corporation,1866,1607,62,237,-175,22,-197,259,14,3,1,-11,2021-08-01
0750,Carroll Consolidated School Corp,1074,929,81,136,-55,9,-64,145,14,8,1,-6,2021-08-01
0755,Delphi Community School Corp,1427,1288,97,125,-28,14,-42,139,10,7,1,-3,2021-08-01
0775,Pioneer Regional School Corp,993,907,31,85,-54,1,-55,86,9,3,0,-6,2021-08-01
0815,Lewis Cass Schools,1297,1055,214,240,-26,2,-28,242,19,16,0,-2,2021-08-01
0875,Logansport Community Sch Corp,4246,4008,194,237,-43,1,-44,238,6,5,0,-1,2021-08-01
0935,Borden-Henryville School Corp,2026,1541,194,443,-249,42,-291,485,24,10,2,-14,2021-08-01
0945,Silver Creek School Corporation,2881,2320,459,480,-21,81,-102,561,19,16,3,-4,2021-08-01
1000,Clarksville Community School Corp,1320,937,2885,330,2555,53,2502,383,29,219,4,190,2021-08-01
1010,Greater Clark County Schools,11623,9842,379,1496,-1117,285,-1402,1781,15,3,2,-12,2021-08-01
1125,Clay Community Schools,3956,3733,214,223,-9,0,-9,223,6,5,0,-0,2021-08-01
1150,Clinton Central School Corporation,798,657,121,132,-11,9,-20,141,18,15,1,-3,2021-08-01
1160,Clinton Prairie School Corporation,1028,922,255,88,167,18,149,106,10,25,2,14,2021-08-01
1170,Community Schools of Frankfort,3366,2891,85,456,-371,19,-390,475,14,3,1,-12,2021-08-01
1180,Rossville Con School District,842,771,151,57,94,14,80,71,8,18,2,10,2021-08-01
1300,Crawford County Community Sch Corp,1486,1284,51,199,-148,3,-151,202,14,3,0,-10,2021-08-01
1315,Barr-Reeve Community Schools Inc,751,677,311,69,242,5,237,74,10,41,1,32,2021-08-01
1375,North Daviess Com Schools,1025,941,177,79,98,5,93,84,8,17,0,9,2021-08-01
1405,Washington Community Schools,2921,2403,19,352,-333,166,-499,518,18,1,6,-17,2021-08-01
1560,Sunman-Dearborn Com Sch Corp,3914,3476,194,343,-149,95,-244,438,11,5,2,-6,2021-08-01
1600,South Dearborn Community Sch Corp,2450,1947,130,433,-303,70,-373,503,21,5,3,-15,2021-08-01
1620,Lawrenceburg Community School Corp,1791,1657,389,125,264,9,255,134,7,22,1,14,2021-08-01
1655,Decatur County Community Schools,1741,1528,313,195,118,18,100,213,12,18,1,6,2021-08-01
1730,Greensburg Community Schools,2315,2055,0,246,-246,14,-260,260,11,0,1,-11,2021-08-01
1805,DeKalb Co Eastern Com Sch Dist,1250,1127,138,106,32,17,15,123,10,11,1,1,2021-08-01
1820,Garrett-Keyser-Butler Com Sch Corp,1612,1444,252,131,121,37,84,168,10,16,2,5,2021-08-01
1835,DeKalb Co Ctl United Sch Dist,3674,3180,202,389,-187,105,-292,494,13,5,3,-8,2021-08-01
1875,Delaware Community School Corp,2496,2174,432,301,131,21,110,322,13,17,1,4,2021-08-01
1885,Wes-Del Community Schools,747,605,242,128,114,14,100,142,19,32,2,13,2021-08-01
1895,Liberty-Perry Community Sch Corp,989,818,383,166,217,5,212,171,17,39,1,21,2021-08-01
1900,Cowan Community School Corp,521,446,344,72,272,3,269,75,14,66,1,52,2021-08-01
1910,Yorktown Community Schools,2351,2082,569,241,328,28,300,269,11,24,1,13,2021-08-01
1940,Daleville Community Schools,623,503,489,116,373,4,369,120,19,78,1,59,2021-08-01
1970,Muncie Community Schools,7069,4587,193,2338,-2145,144,-2289,2482,35,3,2,-32,2021-08-01
2040,Northeast Dubois Co Sch Corp,756,687,79,65,14,4,10,69,9,10,1,1,2021-08-01
2100,Southeast Dubois Co Sch Corp,1169,1104,109,62,47,3,44,65,6,9,0,4,2021-08-01
2110,Southwest Dubois Co Sch Corp,1718,1635,124,80,44,3,41,83,5,7,0,2,2021-08-01
2120,Greater Jasper Consolidated Schs,3247,3027,134,133,1,87,-86,220,7,4,3,-3,2021-08-01
2155,Fairfield Community Schools,2038,1850,306,159,147,29,118,188,9,15,1,6,2021-08-01
2260,Baugo Community Schools,1805,1591,247,174,73,40,33,214,12,14,2,2,2021-08-01
2270,Concord Community Schools,4849,4342,823,409,414,98,316,507,10,17,2,7,2021-08-01
2275,Middlebury Community Schools,4070,3746,495,279,216,45,171,324,8,12,1,4,2021-08-01
2285,Wa-Nee Community Schools,2844,2692,217,124,93,28,65,152,5,8,1,2,2021-08-01
2305,Elkhart Community Schools,13276,11084,371,1798,-1427,394,-1821,2192,17,3,3,-14,2021-08-01
2315,Goshen Community Schools,6738,5933,352,538,-186,267,-453,805,12,5,4,-7,2021-08-01
2395,Fayette County School Corporation,3305,3010,53,222,-169,73,-242,295,9,2,2,-7,2021-08-01
2400,New Albany-Floyd Co Con Sch,11619,10448,922,893,29,278,-249,1171,10,8,2,-2,2021-08-01
2435,Attica Consolidated School Corp,568,512,54,49,5,7,-2,56,10,10,1,-0,2021-08-01
2440,Covington Community School Corp,797,714,80,64,16,19,-3,83,10,10,2,-0,2021-08-01
2455,Southeast Fountain School Corp,1069,947,56,115,-59,7,-66,122,11,5,1,-6,2021-08-01
2475,Franklin County Community Sch Corp,2268,1957,53,251,-198,60,-258,311,14,2,3,-11,2021-08-01
2645,Rochester Community School Corp,1738,1504,156,232,-76,2,-78,234,13,9,0,-4,2021-08-01
2650,Caston School Corporation,689,538,136,151,-15,0,-15,151,22,20,0,-2,2021-08-01
2725,East Gibson School Corporation,899,730,31,160,-129,9,-138,169,19,3,1,-15,2021-08-01
2735,North Gibson School Corporation,2083,1799,78,238,-160,46,-206,284,14,4,2,-10,2021-08-01
2765,South Gibson School Corporation,1924,1740,291,102,189,82,107,184,10,15,4,6,2021-08-01
2815,Eastbrook Community Sch Corp,1340,1225,331,100,231,15,216,115,9,25,1,16,2021-08-01
2825,Madison-Grant United School Corp,1190,988,46,171,-125,31,-156,202,17,4,3,-13,2021-08-01
2855,Mississinewa Community School Corp,1731,1605,681,106,575,20,555,126,7,39,1,32,2021-08-01
2865,Marion Community Schools,5043,3454,54,1350,-1296,239,-1535,1589,32,1,5,-30,2021-08-01
2920,Bloomfield School District,898,751,56,147,-91,0,-91,147,16,6,0,-10,2021-08-01
2940,Eastern Greene Schools,1054,912,137,130,7,12,-5,142,13,13,1,-0,2021-08-01
2950,Linton-Stockton School Corporation,1286,1081,254,205,49,0,49,205,16,20,0,4,2021-08-01
2960,MSD Shakamak Schools,763,594,48,169,-121,0,-121,169,22,6,0,-16,2021-08-01
2980,White River Valley School District,825,629,125,194,-69,2,-71,196,24,15,0,-9,2021-08-01
3005,Hamilton Southeastern Schools,22305,21281,57,696,-639,328,-967,1024,5,0,1,-4,2021-08-01
3025,Hamilton Heights School Corp,2010,1896,299,94,205,20,185,114,6,15,1,9,2021-08-01
3030,Westfield-Washington Schools,8615,8278,80,284,-204,53,-257,337,4,1,1,-3,2021-08-01
3055,Sheridan Community Schools,980,901,114,71,43,8,35,79,8,12,1,4,2021-08-01
3060,Carmel Clay Schools,16355,16019,226,263,-37,73,-110,336,2,1,0,-1,2021-08-01
3070,Noblesville Schools,10978,10205,95,591,-496,182,-678,773,7,1,2,-6,2021-08-01
3115,Southern Hancock Co Com Sch Corp,3191,3004,569,144,425,43,382,187,6,18,1,12,2021-08-01
3125,Greenfield-Central Com Schools,4613,4050,224,503,-279,60,-339,563,12,5,1,-7,2021-08-01
3135,Mt Vernon Community School Corp,4105,3616,644,392,252,97,155,489,12,16,2,4,2021-08-01
3145,Eastern Hancock Co Com Sch Corp,904,783,350,120,230,1,229,121,13,39,0,25,2021-08-01
3160,Lanesville Community School Corp,567,478,243,88,155,1,154,89,16,43,0,27,2021-08-01
3180,North Harrison Com School Corp,2175,1826,258,335,-77,14,-91,349,16,12,1,-4,2021-08-01
3190,South Harrison Com Schools,3222,2833,182,311,-129,78,-207,389,12,6,2,-6,2021-08-01
3295,North West Hendricks Schools,1759,1618,223,104,119,37,82,141,8,13,2,5,2021-08-01
3305,Brownsburg Community School Corp,9775,9241,176,325,-149,209,-358,534,5,2,2,-4,2021-08-01
3315,Avon Community School Corp,10506,9649,163,639,-476,218,-694,857,8,2,2,-7,2021-08-01
3325,Danville Community School Corp,2478,2276,192,172,20,30,-10,202,8,8,1,-0,2021-08-01
3330,Plainfield Community School Corp,5423,5094,434,259,175,70,105,329,6,8,1,2,2021-08-01
3335,Mill Creek Community Sch Corp,1501,1321,147,171,-24,9,-33,180,12,10,1,-2,2021-08-01
3405,Blue River Valley Schools,569,421,159,147,12,1,11,148,26,28,0,2,2021-08-01
3415,South Henry School Corp,648,499,219,148,71,1,70,149,23,34,0,11,2021-08-01
3435,Shenandoah School Corporation,1192,1065,246,117,129,10,119,127,11,21,1,10,2021-08-01
3445,New Castle Community School Corp,3135,2691,209,443,-234,1,-235,444,14,7,0,-7,2021-08-01
3455,C A Beard Memorial School Corp,1304,930,110,371,-261,3,-264,374,29,8,0,-20,2021-08-01
3460,Taylor Community School Corp,1252,746,477,494,-17,12,-29,506,40,38,1,-2,2021-08-01
3470,Northwestern School Corp,1404,1207,593,184,409,13,396,197,14,42,1,28,2021-08-01
3480,Eastern Howard School Corporation,1040,926,578,110,468,4,464,114,11,56,0,45,2021-08-01
3490,Western School Corporation,2326,1999,579,307,272,20,252,327,14,25,1,11,2021-08-01
3500,Kokomo School Corporation,6667,4809,373,1733,-1360,125,-1485,1858,28,6,2,-22,2021-08-01
3625,Huntington Co Com Sch Corp,5396,4847,92,442,-350,107,-457,549,10,2,2,-8,2021-08-01
3640,Medora Community School Corp,209,130,32,77,-45,2,-47,79,38,15,1,-22,2021-08-01
3675,Seymour Community Schools,5466,4987,144,200,-56,279,-335,479,9,3,5,-6,2021-08-01
3695,Brownstown Cnt Com Sch Corp,1434,1308,171,97,74,29,45,126,9,12,2,3,2021-08-01
3710,Crothersville Community Schools,557,437,0,108,-108,12,-120,120,22,0,2,-22,2021-08-01
3785,Kankakee Valley School Corp,3408,3069,81,180,-99,159,-258,339,10,2,5,-8,2021-08-01
3815,Rensselaer Central School Corp,1454,1321,99,103,-4,30,-34,133,9,7,2,-2,2021-08-01
3945,Jay School Corporation,3164,2878,82,198,-116,88,-204,286,9,3,3,-6,2021-08-01
3995,Madison Consolidated Schools,3188,2406,107,524,-417,258,-675,782,25,3,8,-21,2021-08-01
4000,Southwestern-Jefferson Co Con,1196,966,283,183,100,47,53,230,19,24,4,4,2021-08-01
4015,Jennings County School Corporation,4161,3771,109,294,-185,96,-281,390,9,3,2,-7,2021-08-01
4145,Clark-Pleasant Community Sch Corp,7492,6568,164,738,-574,186,-760,924,12,2,2,-10,2021-08-01
4205,Center Grove Community School Corp,9030,8349,456,482,-26,199,-225,681,8,5,2,-2,2021-08-01
4215,Edinburgh Community School Corp,801,659,146,130,16,12,4,142,18,18,1,0,2021-08-01
4225,Franklin Community School Corp,5110,4552,308,441,-133,117,-250,558,11,6,2,-5,2021-08-01
4245,Greenwood Community Sch Corp,3553,3188,723,274,449,91,358,365,10,20,3,10,2021-08-01
4255,Nineveh-Hensley-Jackson United,1724,1518,382,190,192,16,176,206,12,22,1,10,2021-08-01
4315,North Knox School Corp,1452,1227,12,204,-192,21,-213,225,15,1,1,-15,2021-08-01
4325,South Knox School Corp,1057,942,276,88,188,27,161,115,11,26,3,15,2021-08-01
4335,Vincennes Community School Corp,2944,2571,134,273,-139,100,-239,373,13,5,3,-8,2021-08-01
4345,Wawasee Community School Corp,2900,2612,162,276,-114,12,-126,288,10,6,0,-4,2021-08-01
4415,Warsaw Community Schools,6793,6252,411,408,3,133,-130,541,8,6,2,-2,2021-08-01
4445,Tippecanoe Valley School Corp,1847,1569,157,273,-116,5,-121,278,15,9,0,-7,2021-08-01
4455,Whitko Community School Corp,1470,1124,108,330,-222,16,-238,346,24,7,1,-16,2021-08-01
4515,Prairie Heights Community Sch Corp,1263,1083,226,178,48,2,46,180,14,18,0,4,2021-08-01
4525,Westview School Corporation,1929,1793,285,134,151,2,149,136,7,15,0,8,2021-08-01
4535,Lakeland School Corporation,1956,1538,53,415,-362,3,-365,418,21,3,0,-19,2021-08-01
4580,Hanover Community School Corp,2625,2458,29,92,-63,75,-138,167,6,1,3,-5,2021-08-01
4590,River Forest Community Sch Corp,1373,1271,301,78,223,24,199,102,7,22,2,14,2021-08-01
4600,Merrillville Community School Corp,6590,5790,47,529,-482,271,-753,800,12,1,4,-11,2021-08-01
4615,Lake Central School Corporation,9490,9108,62,224,-162,158,-320,382,4,1,2,-3,2021-08-01
4645,Tri-Creek School Corporation,3208,3066,94,97,-3,45,-48,142,4,3,1,-1,2021-08-01
4650,Lake Ridge New Tech Schools,1746,1517,73,146,-73,81,-154,227,13,4,5,-9,2021-08-01
4660,Crown Point Community School Corp,9003,8614,3,212,-209,177,-386,389,4,0,2,-4,2021-08-01
4670,School City of East Chicago,4934,3315,109,1250,-1141,369,-1510,1619,33,2,7,-31,2021-08-01
4680,Lake Station Community Schools,1330,1027,137,245,-108,58,-166,303,23,10,4,-12,2021-08-01
4690,Gary Community School Corp,11432,4445,0,6429,-6429,558,-6987,6987,61,0,5,-61,2021-08-01
4700,Griffith Public Schools,2157,1910,73,180,-107,67,-174,247,11,3,3,-8,2021-08-01
4710,School City of Hammond,13396,11058,648,1372,-724,966,-1690,2338,17,5,7,-13,2021-08-01
4720,School Town of Highland,3208,2992,69,121,-52,95,-147,216,7,2,3,-5,2021-08-01
4730,School City of Hobart,4131,3846,23,225,-202,60,-262,285,7,1,1,-6,2021-08-01
4740,School Town of Munster,3966,3861,185,67,118,38,80,105,3,5,1,2,2021-08-01
4760,School City of Whiting,829,755,379,56,323,18,305,74,9,46,2,37,2021-08-01
4805,New Prairie United School Corp,2450,2240,586,190,396,20,376,210,9,24,1,15,2021-08-01
4860,MSD of New Durham Township,742,592,281,141,140,9,131,150,20,38,1,18,2021-08-01
4915,Tri-Township Cons School Corp,478,242,86,234,-148,2,-150,236,49,18,0,-31,2021-08-01
4925,Michigan City Area Schools,6447,5245,0,814,-814,388,-1202,1202,19,0,6,-19,2021-08-01
4940,South Central Com School Corp,669,568,360,93,267,8,259,101,15,54,1,39,2021-08-01
4945,LaPorte Community School Corp,6169,5537,295,551,-256,81,-337,632,10,5,1,-5,2021-08-01
5075,North Lawrence Com Schools,4616,4147,88,372,-284,97,-381,469,10,2,2,-8,2021-08-01
5085,Mitchell Community Schools,1568,1361,69,202,-133,5,-138,207,13,4,0,-9,2021-08-01
5245,Frankton-Lapel Community Schools,2173,2061,886,92,794,20,774,112,5,41,1,36,2021-08-01
5255,South Madison Com Sch Corp,4026,3795,535,212,323,19,304,231,6,13,0,8,2021-08-01
5265,Alexandria Community School Corp,1484,1241,235,176,59,67,-8,243,16,16,5,-1,2021-08-01
5275,Anderson Community School Corp,9834,6300,32,2870,-2838,664,-3502,3534,36,0,7,-36,2021-08-01
5280,Elwood Community School Corp,1518,1276,79,233,-154,9,-163,242,16,5,1,-11,2021-08-01
5300,MSD Decatur Township,7273,6314,301,749,-448,191,-639,940,13,4,3,-9,2021-08-01
5310,Franklin Township Com Sch Corp,11639,10345,93,804,-711,490,-1201,1294,11,1,4,-10,2021-08-01
5330,MSD Lawrence Township,16273,14116,1361,1453,-92,704,-796,2157,13,8,4,-5,2021-08-01
5340,Perry Township Schools,18406,16075,351,1082,-731,1249,-1980,2331,13,2,7,-11,2021-08-01
5350,MSD Pike Township,12432,10754,34,1051,-1017,627,-1644,1678,13,0,5,-13,2021-08-01
5360,MSD Warren Township,13662,11015,434,1929,-1495,718,-2213,2647,19,3,5,-16,2021-08-01
5370,MSD Washington Township,11349,9956,823,849,-26,544,-570,1393,12,7,5,-5,2021-08-01
5375,MSD Wayne Township,16486,15169,1201,837,364,480,-116,1317,8,7,3,-1,2021-08-01
5380,Beech Grove City Schools,2041,1729,1191,202,989,108,881,310,15,58,5,43,2021-08-01
5385,Indianapolis Public Schools,46072,21127,1149,21221,-20072,3724,-23796,24945,54,2,8,-52,2021-08-01
5400,School Town of Speedway,2010,1777,0,195,-195,38,-233,233,12,0,2,-12,2021-08-01
5455,Culver Community Schools Corp,832,611,123,210,-87,11,-98,221,27,15,1,-12,2021-08-01
5470,Argos Community Schools,627,482,114,141,-27,4,-31,145,23,18,1,-5,2021-08-01
5480,Bremen Public Schools,1250,1197,244,52,192,1,191,53,4,20,0,15,2021-08-01
5485,Plymouth Community School Corp,3252,2899,405,276,129,77,52,353,11,12,2,2,2021-08-01
5495,Triton School Corporation,807,703,139,101,38,3,35,104,13,17,0,4,2021-08-01
5520,Shoals Community School Corp,652,578,32,70,-38,4,-42,74,11,5,1,-6,2021-08-01
5525,Loogootee Community Sch Corp,818,651,110,167,-57,0,-57,167,20,13,0,-7,2021-08-01
5615,Maconaquah School Corp,2123,1704,262,409,-147,10,-157,419,20,12,0,-7,2021-08-01
5620,North Miami Community Schools,786,674,131,112,19,0,19,112,14,17,0,2,2021-08-01
5625,Oak Hill United School Corp,1230,1147,503,67,436,16,420,83,7,41,1,34,2021-08-01
5635,Peru Community Schools,2040,1678,271,362,-91,0,-91,362,18,13,0,-4,2021-08-01
5705,Richland-Bean Blossom C S C,2687,2275,287,357,-70,55,-125,412,15,11,2,-5,2021-08-01
5740,Monroe County Community Sch Corp,11049,9927,331,877,-546,245,-791,1122,10,3,2,-7,2021-08-01
5835,North Montgomery Com Sch Corp,1815,1614,141,192,-51,9,-60,201,11,8,0,-3,2021-08-01
5845,South Montgomery Com Sch Corp,1694,1454,108,238,-130,2,-132,240,14,6,0,-8,2021-08-01
5855,Crawfordsville Community Schools,2363,2149,246,210,36,4,32,214,9,10,0,1,2021-08-01
5900,Monroe-Gregg School District,1366,1219,266,125,141,22,119,147,11,19,2,9,2021-08-01
5910,Eminence Community School Corp,389,276,52,102,-50,11,-61,113,29,13,3,-16,2021-08-01
5925,MSD Martinsville Schools,4544,3729,103,601,-498,214,-712,815,18,2,5,-16,2021-08-01
5930,Mooresville Con School Corp,4108,3634,659,355,304,118,186,473,12,16,3,5,2021-08-01
5945,North Newton School Corp,1257,1118,22,127,-105,12,-117,139,11,2,1,-9,2021-08-01
5995,South Newton School Corp,772,719,70,53,17,0,17,53,7,9,0,2,2021-08-01
6055,Central Noble Com School Corp,1185,1066,142,113,29,6,23,119,10,12,1,2,2021-08-01
6060,East Noble School Corporation,3509,3140,202,287,-85,82,-167,369,11,6,2,-5,2021-08-01
6065,West Noble School Corporation,2228,2028,160,192,-32,8,-40,200,9,7,0,-2,2021-08-01
6080,Rising Sun-Ohio Co Com,807,754,72,46,26,7,19,53,7,9,1,2,2021-08-01
6145,Orleans Community Schools,761,670,181,91,90,0,90,91,12,24,0,12,2021-08-01
6155,Paoli Community School Corp,1252,1118,109,132,-23,2,-25,134,11,9,0,-2,2021-08-01
6160,Springs Valley Com School Corp,846,762,75,84,-9,0,-9,84,10,9,0,-1,2021-08-01
6195,Spencer-Owen Community Schools,2408,1993,105,396,-291,19,-310,415,17,4,1,-13,2021-08-01
6260,Southwest Parke Com Sch Corp,837,750,203,87,116,0,116,87,10,24,0,14,2021-08-01
6325,Perry Central Com Schools Corp,958,850,387,107,280,1,279,108,11,40,0,29,2021-08-01
6340,Cannelton City Schools,293,134,117,159,-42,0,-42,159,54,40,0,-14,2021-08-01
6350,Tell City-Troy Twp School Corp,1630,1218,127,411,-284,1,-285,412,25,8,0,-17,2021-08-01
6375,North Central Parke Comm Schl Corp,1197,1066,93,131,-38,0,-38,131,11,8,0,-3,2021-08-01
6445,Pike County School Corp,1797,1527,50,269,-219,1,-220,270,15,3,0,-12,2021-08-01
6460,MSD Boone Township,1008,922,146,73,73,13,60,86,9,14,1,6,2021-08-01
6470,Duneland School Corporation,5880,5486,298,359,-61,35,-96,394,7,5,1,-2,2021-08-01
6510,East Porter County School Corp,2341,2156,234,166,68,19,49,185,8,10,1,2,2021-08-01
6520,Porter Township School Corp,1363,1262,123,87,36,14,22,101,7,9,1,2,2021-08-01
6530,Union Township School Corp,1446,1342,89,93,-4,11,-15,104,7,6,1,-1,2021-08-01
6550,Portage Township Schools,7633,6960,33,535,-502,138,-640,673,9,0,2,-8,2021-08-01
6560,Valparaiso Community Schools,6579,6101,87,385,-298,93,-391,478,7,1,1,-6,2021-08-01
6590,MSD Mount Vernon,2099,1916,66,103,-37,80,-117,183,9,3,4,-6,2021-08-01
6600,MSD North Posey Co Schools,1416,1254,141,83,58,79,-21,162,11,10,6,-1,2021-08-01
6620,Eastern Pulaski Community Sch Corp,990,923,189,67,122,0,122,67,7,19,0,12,2021-08-01
6630,West Central School Corp,667,601,56,62,-6,4,-10,66,10,8,1,-1,2021-08-01
6705,South Putnam Community Schools,1072,893,153,179,-26,0,-26,179,17,14,0,-2,2021-08-01
6715,North Putnam Community Schools,1431,1194,54,236,-182,1,-183,237,17,4,0,-13,2021-08-01
6750,Cloverdale Community Schools,1031,909,274,118,156,4,152,122,12,27,0,15,2021-08-01
6755,Greencastle Community School Corp,1730,1559,145,168,-23,3,-26,171,10,8,0,-2,2021-08-01
6795,Union School Corporation,370,150,6184,220,5964,0,5964,220,59,1671,0,1612,2021-08-01
6805,Randolph Southern School Corp,431,369,102,61,41,1,40,62,14,24,0,9,2021-08-01
6820,Monroe Central School Corp,849,750,321,96,225,3,222,99,12,38,0,26,2021-08-01
6825,Randolph Central School Corp,1390,1195,120,193,-73,2,-75,195,14,9,0,-5,2021-08-01
6835,Randolph Eastern School Corp,911,843,33,68,-35,0,-35,68,7,4,0,-4,2021-08-01
6865,South Ripley Com Sch Corp,1147,984,105,144,-39,19,-58,163,14,9,2,-5,2021-08-01
6895,Batesville Community School Corp,2014,1830,283,85,198,99,99,184,9,14,5,5,2021-08-01
6900,Jac-Cen-Del Community Sch Corp,815,680,88,125,-37,10,-47,135,17,11,1,-6,2021-08-01
6910,Milan Community Schools,881,737,227,126,101,18,83,144,16,26,2,9,2021-08-01
6995,Rush County Schools,2091,1759,111,283,-172,49,-221,332,16,5,2,-11,2021-08-01
7150,John Glenn School Corporation,1623,1452,527,140,387,31,356,171,11,32,2,22,2021-08-01
7175,Penn-Harris-Madison School Corp,10215,9268,1908,673,1235,274,961,947,9,19,3,9,2021-08-01
7200,School City of Mishawaka,4631,3781,1327,642,685,208,477,850,18,29,4,10,2021-08-01
7205,South Bend Community School Corp,22468,15091,238,4739,-4501,2638,-7139,7377,33,1,12,-32,2021-08-01
7215,Union-North United School Corp,1134,834,417,285,132,15,117,300,26,37,1,10,2021-08-01
7230,Scott County School District 1,1350,1205,0,124,-124,21,-145,145,11,0,2,-11,2021-08-01
7255,Scott County School District 2,2462,2296,256,106,150,60,90,166,7,10,2,4,2021-08-01
7285,Shelby Eastern Schools,1279,960,147,312,-165,7,-172,319,25,11,1,-13,2021-08-01
7350,Northwestern Con School Corp,1214,1092,312,106,206,16,190,122,10,26,1,16,2021-08-01
7360,Southwestern Con Sch Shelby Co,592,446,99,142,-43,4,-47,146,25,17,1,-8,2021-08-01
7365,Shelbyville Central Schools,3830,3484,256,302,-46,44,-90,346,9,7,1,-2,2021-08-01
7385,North Spencer County Sch Corp,1981,1857,93,115,-22,9,-31,124,6,5,0,-2,2021-08-01
7445,South Spencer County Sch Corp,1168,1082,24,49,-25,37,-62,86,7,2,3,-5,2021-08-01
7495,Oregon-Davis School Corp,643,372,118,267,-149,4,-153,271,42,18,1,-24,2021-08-01
7515,North Judson-San Pierre Sch Corp,1172,899,47,212,-165,61,-226,273,23,4,5,-19,2021-08-01
7525,Knox Community School Corp,1698,1450,246,230,16,18,-2,248,15,14,1,-0,2021-08-01
7605,Fremont Community Schools,987,875,84,112,-28,0,-28,112,11,9,0,-3,2021-08-01
7610,Hamilton Community Schools,480,255,65,225,-160,0,-160,225,47,14,0,-33,2021-08-01
7615,MSD Steuben County,2444,2227,287,215,72,2,70,217,9,12,0,3,2021-08-01
7645,Northeast School Corp,1174,651,93,522,-429,1,-430,523,45,8,0,-37,2021-08-01
7715,Southwest School Corporation,1766,1521,206,245,-39,0,-39,245,14,12,0,-2,2021-08-01
7775,Switzerland County School Corp,1523,1408,39,109,-70,6,-76,115,8,3,0,-5,2021-08-01
7855,Lafayette School Corporation,7786,7088,368,271,97,427,-330,698,9,5,5,-4,2021-08-01
7865,Tippecanoe School Corp,14363,13117,232,839,-607,407,-1014,1246,9,2,3,-7,2021-08-01
7875,West Lafayette Com School Corp,2230,2162,146,55,91,13,78,68,3,7,1,3,2021-08-01
7935,Tri-Central Community Schools,632,487,243,144,99,1,98,145,23,38,0,16,2021-08-01
7945,Tipton Community School Corp,1524,1290,122,226,-104,8,-112,234,15,8,1,-7,2021-08-01
7950,Union Co/Clg Corner Joint Sch Dist,1244,1185,88,57,31,2,29,59,5,7,0,2,2021-08-01
7995,Evansville Vanderburgh School Corp,23954,21204,89,1266,-1177,1484,-2661,2750,11,0,6,-11,2021-08-01
8010,North Vermillion Com Sch Corp,661,610,90,50,40,1,39,51,8,14,0,6,2021-08-01
8020,South Vermillion Com Sch Corp,1738,1533,62,199,-137,6,-143,205,12,4,0,-8,2021-08-01
8030,Vigo County School Corp,14165,13249,110,769,-659,147,-806,916,6,1,1,-6,2021-08-01
8045,Manchester Community Schools,1341,1219,141,108,33,14,19,122,9,11,1,1,2021-08-01
8050,MSD Wabash County Schools,1737,1342,736,371,365,24,341,395,23,42,1,20,2021-08-01
8060,Wabash City Schools,1464,1106,347,345,2,13,-11,358,24,24,1,-1,2021-08-01
8115,MSD Warren County,1392,1306,0,85,-85,1,-86,86,6,0,0,-6,2021-08-01
8130,Warrick County School Corp,10348,9714,206,417,-211,217,-428,634,6,2,2,-4,2021-08-01
8205,Salem Community Schools,1958,1596,155,359,-204,3,-207,362,18,8,0,-11,2021-08-01
8215,East Washington School Corp,1396,1181,199,208,-9,7,-16,215,15,14,1,-1,2021-08-01
8220,West Washington School Corp,777,643,231,134,97,0,97,134,17,30,0,12,2021-08-01
8305,Nettle Creek School Corporation,973,819,271,150,121,4,117,154,16,28,0,12,2021-08-01
8355,Western Wayne Schools,842,684,103,155,-52,3,-55,158,19,12,0,-7,2021-08-01
8360,Centerville-Abington Com Schs,1425,1296,435,111,324,18,306,129,9,31,1,21,2021-08-01
8375,Northeastern Wayne Schools,925,831,434,85,349,9,340,94,10,47,1,37,2021-08-01
8385,Richmond Community Schools,5486,4312,91,935,-844,239,-1083,1174,21,2,4,-20,2021-08-01
8425,Southern Wells Com Schools,662,572,259,89,170,1,169,90,14,39,0,26,2021-08-01
8435,Northern Wells Community Schools,2315,1984,436,311,125,20,105,331,14,19,1,5,2021-08-01
8445,MSD Bluffton-Harrison,1505,1324,338,179,159,2,157,181,12,22,0,10,2021-08-01
8515,North White School Corp,965,821,25,144,-119,0,-119,144,15,3,0,-12,2021-08-01
8525,Frontier School Corporation,660,543,75,111,-36,6,-42,117,18,11,1,-6,2021-08-01
8535,Tri-County School Corporation,737,664,62,73,-11,0,-11,73,10,8,0,-1,2021-08-01
8565,Twin Lakes School Corp,2222,2057,116,149,-33,16,-49,165,7,5,1,-2,2021-08-01
8625,Smith-Green Community Schools,1050,963,196,71,125,16,109,87,8,19,2,10,2021-08-01
8665,Whitley County Con Schools,3484,3215,248,209,39,60,-21,269,8,7,2,-1,2021-08-01
0015,Adams Central Community Schools,1053,975,303,66,237,12,225,78,7,29,1,21,2020-08-01
0025,North Adams Community Schools,2032,1583,90,296,-206,153,-359,449,22,4,8,-18,2020-08-01
0035,South Adams Schools,1238,1153,88,82,6,3,3,85,7,7,0,0,2020-08-01
0125,M S D Southwest Allen County Schls,7882,7528,90,121,-31,233,-264,354,4,1,3,-3,2020-08-01
0225,Northwest Allen County Schools,8232,7778,44,226,-182,228,-410,454,6,1,3,-5,2020-08-01
0235,Fort Wayne Community Schools,35164,28507,37,2116,-2079,4541,-6620,6657,19,0,13,-19,2020-08-01
0255,East Allen County Schools,10408,9001,859,385,474,1022,-548,1407,14,8,10,-5,2020-08-01
0365,Bartholomew Con School Corp,11814,10942,310,372,-62,500,-562,872,7,3,4,-5,2020-08-01
0370,Flat Rock-Hawcreek School Corp,872,789,153,77,76,6,70,83,10,18,1,8,2020-08-01
0395,Benton Community School Corp,1836,1675,44,76,-32,85,-117,161,9,2,5,-6,2020-08-01
0515,Blackford County Schools,1795,1542,21,252,-231,1,-232,253,14,1,0,-13,2020-08-01
0615,Western Boone Co Com Sch Dist,1600,1498,182,89,93,13,80,102,6,11,1,5,2020-08-01
0630,Zionsville Community Schools,7221,7081,60,94,-34,46,-80,140,2,1,1,-1,2020-08-01
0665,Lebanon Community School Corp,3614,3320,68,224,-156,70,-226,294,8,2,2,-6,2020-08-01
0670,Brown County School Corporation,1933,1702,58,205,-147,26,-173,231,12,3,1,-9,2020-08-01
