corp_id,corp_name,in_stlmt_tot,res_nrl,public_xfr_in,public_xfr_out,net_pub_xfr,xfr_ch_schlsp_out,net_xfr,xfr_out_tot,xfr_out_tot_rate,xfr_in_rate,pr_xfr_out_rate,net_xfr_rate,yr
1125,Clay Community Schools,4020,3839,176,178,-2,3,-5,181,5,4,0,-0,2019-08-01
1150,Clinton Central School Corporation,853,757,112,93,19,3,16,96,11,13,0,2,2019-08-01
1160,Clinton Prairie School Corporation,1292,1224,3,51,-48,17,-65,68,5,0,1,-5,2019-08-01
1170,Community Schools of Frankfort,3228,3010,61,190,-129,28,-157,218,7,2,1,-5,2019-08-01
1180,Rossville Con School District,879,826,132,48,84,5,79,53,6,15,1,9,2019-08-01
1300,Crawford County Community Sch Corp,1578,1413,10,165,-155,0,-155,165,10,1,0,-10,2019-08-01
1315,Barr-Reeve Community Schools Inc,741,679,239,60,179,2,177,62,8,32,0,24,2019-08-01
1375,North Daviess Com Schools,1080,1022,154,54,100,4,96,58,5,14,0,9,2019-08-01
1405,Washington Community Schools,3023,2520,1,294,-293,209,-502,503,17,0,7,-17,2019-08-01
1560,Sunman-Dearborn Com Sch Corp,3888,3466,159,349,-190,73,-263,422,11,4,2,-7,2019-08-01
1600,South Dearborn Community Sch Corp,2635,2159,138,396,-258,80,-338,476,18,5,3,-13,2019-08-01
1620,Lawrenceburg Community School Corp,1793,1686,342,94,248,13,235,107,6,19,1,13,2019-08-01
1655,Decatur County Community Schools,1842,1666,266,153,113,23,90,176,10,14,1,5,2019-08-01
1730,Greensburg Community Schools,2325,2091,0,200,-200,34,-234,234,10,0,1,-10,2019-08-01
1805,DeKalb Co Eastern Com Sch Dist,1334,1216,107,97,10,21,-11,118,9,8,2,-1,2019-08-01
1820,Garrett-Keyser-Butler Com Sch Corp,1650,1500,220,103,117,47,70,150,9,13,3,4,2019-08-01
1835,DeKalb Co Ctl United Sch Dist,3832,3351,170,358,-188,123,-311,481,13,4,3,-8,2019-08-01
1875,Delaware Community School Corp,2542,2253,393,283,110,6,104,289,11,15,0,4,2019-08-01
1885,Wes-Del Community Schools,798,654,192,127,65,17,48,144,18,24,2,6,2019-08-01
1895,Liberty-Perry Community Sch Corp,858,733,462,121,341,4,337,125,15,54,0,39,2019-08-01
1900,Cowan Community School Corp,588,507,298,79,219,2,217,81,14,51,0,37,2019-08-01
1910,Yorktown Community Schools,2394,2138,495,231,264,25,239,256,11,21,1,10,2019-08-01
1940,Daleville Community Schools,622,509,440,103,337,10,327,113,18,71,2,53,2019-08-01
1970,Muncie Community Schools,7177,4759,180,2255,-2075,163,-2238,2418,34,3,2,-31,2019-08-01
2040,Northeast Dubois Co Sch Corp,798,750,71,48,23,0,23,48,6,9,0,3,2019-08-01
2100,Southeast Dubois Co Sch Corp,1168,1126,123,42,81,0,81,42,4,11,0,7,2019-08-01
2110,Southwest Dubois Co Sch Corp,1735,1637,87,92,-5,6,-11,98,6,5,0,-1,2019-08-01
2120,Greater Jasper Consolidated Schs,3239,3032,107,125,-18,82,-100,207,6,3,3,-3,2019-08-01
2155,Fairfield Community Schools,2074,1916,232,128,104,30,74,158,8,11,1,4,2019-08-01
2260,Baugo Community Schools,1816,1622,232,152,80,42,38,194,11,13,2,2,2019-08-01
2270,Concord Community Schools,4985,4562,764,342,422,81,341,423,8,15,2,7,2019-08-01
2275,Middlebury Community Schools,4356,4076,449,203,246,77,169,280,6,10,2,4,2019-08-01
2285,Wa-Nee Community Schools,2956,2804,214,122,92,30,62,152,5,7,1,2,2019-08-01
2305,Elkhart Community Schools,13845,11803,310,1643,-1333,399,-1732,2042,15,2,3,-13,2019-08-01
2315,Goshen Community Schools,6927,6232,291,450,-159,245,-404,695,10,4,4,-6,2019-08-01
2395,Fayette County School Corporation,3417,3143,56,193,-137,81,-218,274,8,2,2,-6,2019-08-01
2400,New Albany-Floyd Co Con Sch,11793,10670,829,821,8,302,-294,1123,10,7,3,-2,2019-08-01
2435,Attica Consolidated School Corp,603,550,39,45,-6,8,-14,53,9,6,1,-2,2019-08-01
2440,Covington Community School Corp,855,768,73,61,12,26,-14,87,10,9,3,-2,2019-08-01
2455,Southeast Fountain School Corp,1054,964,57,90,-33,0,-33,90,9,5,0,-3,2019-08-01
2475,Franklin County Community Sch Corp,2394,2139,27,204,-177,51,-228,255,11,1,2,-10,2019-08-01
2645,Rochester Community School Corp,1731,1530,152,199,-47,2,-49,201,12,9,0,-3,2019-08-01
2650,Caston School Corporation,645,526,129,119,10,0,10,119,18,20,0,2,2019-08-01
2725,East Gibson School Corporation,974,806,20,156,-136,12,-148,168,17,2,1,-15,2019-08-01
2735,North Gibson School Corporation,2165,1888,63,211,-148,66,-214,277,13,3,3,-10,2019-08-01
2765,South Gibson School Corporation,1913,1745,276,101,175,67,108,168,9,14,4,6,2019-08-01
2815,Eastbrook Community Sch Corp,1382,1272,317,92,225,18,207,110,8,23,1,15,2019-08-01
2825,Madison-Grant United School Corp,1227,1049,35,147,-112,31,-143,178,15,3,3,-12,2019-08-01
2855,Mississinewa Community School Corp,1832,1686,616,112,504,34,470,146,8,34,2,26,2019-08-01
2865,Marion Community Schools,5069,3499,48,1371,-1323,199,-1522,1570,31,1,4,-30,2019-08-01
2920,Bloomfield School District,911,745,62,164,-102,2,-104,166,18,7,0,-11,2019-08-01
2940,Eastern Greene Schools,1165,1043,79,103,-24,19,-43,122,10,7,2,-4,2019-08-01
2950,Linton-Stockton School Corporation,1295,1107,234,188,46,0,46,188,15,18,0,4,2019-08-01
2960,M S D Shakamak Schools,824,704,37,120,-83,0,-83,120,15,4,0,-10,2019-08-01
2980,White River Valley School District,796,622,123,174,-51,0,-51,174,22,15,0,-6,2019-08-01
3005,Hamilton Southeastern Schools,22400,21470,42,651,-609,279,-888,930,4,0,1,-4,2019-08-01
3025,Hamilton Heights School Corp,2123,2018,202,87,115,18,97,105,5,10,1,5,2019-08-01
3030,Westfield-Washington Schools,8263,7996,75,221,-146,46,-192,267,3,1,1,-2,2019-08-01
3055,Sheridan Community Schools,1037,923,92,102,-10,12,-22,114,11,9,1,-2,2019-08-01
3060,Carmel Clay Schools,16390,16032,190,255,-65,103,-168,358,2,1,1,-1,2019-08-01
3070,Noblesville Schools,10971,10237,79,565,-486,169,-655,734,7,1,2,-6,2019-08-01
3115,Southern Hancock Co Com Sch Corp,3306,3109,507,156,351,41,310,197,6,15,1,9,2019-08-01
3125,Greenfield-Central Com Schools,4687,4231,222,399,-177,57,-234,456,10,5,1,-5,2019-08-01
3135,Mt Vernon Community School Corp,3820,3364,692,374,318,82,236,456,12,18,2,6,2019-08-01
3145,Eastern Hancock Co Com Sch Corp,992,896,286,94,192,2,190,96,10,29,0,19,2019-08-01
3160,Lanesville Community School Corp,553,450,309,92,217,11,206,103,19,56,2,37,2019-08-01
3180,North Harrison Com School Corp,2222,1961,196,250,-54,11,-65,261,12,9,0,-3,2019-08-01
3190,South Harrison Com Schools,3341,2873,102,390,-288,78,-366,468,14,3,2,-11,2019-08-01
3295,North West Hendricks Schools,1770,1653,176,93,83,24,59,117,7,10,1,3,2019-08-01
3305,Brownsburg Community School Corp,9375,8904,165,241,-76,230,-306,471,5,2,2,-3,2019-08-01
3315,Avon Community School Corp,10125,9432,193,505,-312,188,-500,693,7,2,2,-5,2019-08-01
3325,Danville Community School Corp,2573,2365,150,172,-22,36,-58,208,8,6,1,-2,2019-08-01
3330,Plainfield Community School Corp,5452,5119,366,262,104,71,33,333,6,7,1,1,2019-08-01
3335,Mill Creek Community Sch Corp,1530,1351,98,170,-72,9,-81,179,12,6,1,-5,2019-08-01
3405,Blue River Valley Schools,619,493,150,125,25,1,24,126,20,24,0,4,2019-08-01
3415,South Henry School Corp,647,514,228,127,101,6,95,133,21,35,1,15,2019-08-01
3435,Shenandoah School Corporation,1267,1139,245,120,125,8,117,128,10,19,1,9,2019-08-01
3445,New Castle Community School Corp,3322,2885,191,435,-244,2,-246,437,13,6,0,-7,2019-08-01
3455,C A Beard Memorial School Corp,1252,878,66,373,-307,1,-308,374,30,5,0,-25,2019-08-01
3460,Taylor Community School Corp,1352,878,354,464,-110,10,-120,474,35,26,1,-9,2019-08-01
3470,Northwestern School Corp,1413,1236,571,165,406,12,394,177,13,40,1,28,2019-08-01
3480,Eastern Howard School Corporation,1106,1026,494,80,414,0,414,80,7,45,0,37,2019-08-01
3490,Western School Corporation,2383,2069,617,290,327,24,303,314,13,26,1,13,2019-08-01
3500,Kokomo School Corporation,6801,5122,406,1536,-1130,143,-1273,1679,25,6,2,-19,2019-08-01
3625,Huntington Co Com Sch Corp,5468,4946,41,408,-367,114,-481,522,10,1,2,-9,2019-08-01
3640,Medora Community School Corp,208,125,22,81,-59,2,-61,83,40,11,1,-29,2019-08-01
3675,Seymour Community Schools,5234,4751,122,211,-89,272,-361,483,9,2,5,-7,2019-08-01
3695,Brownstown Cnt Com Sch Corp,1528,1404,184,97,87,27,60,124,8,12,2,4,2019-08-01
3710,Crothersville Community Schools,519,400,0,104,-104,15,-119,119,23,0,3,-23,2019-08-01
3785,Kankakee Valley School Corp,3556,3251,81,151,-70,154,-224,305,9,2,4,-6,2019-08-01
3815,Rensselaer Central School Corp,1559,1468,91,69,22,22,0,91,6,6,1,0,2019-08-01
3945,Jay School Corporation,3283,3033,83,202,-119,48,-167,250,8,3,1,-5,2019-08-01
3995,Madison Consolidated Schools,3059,2503,68,311,-243,245,-488,556,18,2,8,-16,2019-08-01
4000,Southwestern-Jefferson Co Con,1425,1224,61,147,-86,54,-140,201,14,4,4,-10,2019-08-01
4015,Jennings County School Corporation,4300,3946,111,251,-140,103,-243,354,8,3,2,-6,2019-08-01
4145,Clark-Pleasant Community Sch Corp,7250,6524,83,567,-484,159,-643,726,10,1,2,-9,2019-08-01
4205,Center Grove Community School Corp,8692,8036,325,444,-119,212,-331,656,8,4,2,-4,2019-08-01
4215,Edinburgh Community School Corp,792,658,134,118,16,16,0,134,17,17,2,0,2019-08-01
4225,Franklin Community School Corp,5152,4705,312,321,-9,126,-135,447,9,6,2,-3,2019-08-01
4245,Greenwood Community Sch Corp,3681,3319,648,247,401,115,286,362,10,18,3,8,2019-08-01
4255,Nineveh-Hensley-Jackson United,1757,1582,275,153,122,22,100,175,10,16,1,6,2019-08-01
4315,North Knox School Corp,1473,1295,7,157,-150,21,-171,178,12,0,1,-12,2019-08-01
4325,South Knox School Corp,1056,982,265,56,209,18,191,74,7,25,2,18,2019-08-01
4335,Vincennes Community School Corp,2956,2575,105,274,-169,107,-276,381,13,4,4,-9,2019-08-01
4345,Wawasee Community School Corp,2975,2735,183,226,-43,14,-57,240,8,6,0,-2,2019-08-01
4415,Warsaw Community Schools,7016,6530,352,336,16,150,-134,486,7,5,2,-2,2019-08-01
4445,Tippecanoe Valley School Corp,1881,1634,124,242,-118,5,-123,247,13,7,0,-7,2019-08-01
4455,Whitko Community School Corp,1539,1219,100,294,-194,26,-220,320,21,6,2,-14,2019-08-01
4515,Prairie Heights Community Sch Corp,1343,1168,128,172,-44,3,-47,175,13,10,0,-3,2019-08-01
4525,Westview School Corporation,2062,1959,253,95,158,8,150,103,5,12,0,7,2019-08-01
4535,Lakeland School Corporation,2065,1767,70,297,-227,1,-228,298,14,3,0,-11,2019-08-01
4580,Hanover Community School Corp,2507,2344,16,85,-69,78,-147,163,7,1,3,-6,2019-08-01
4590,River Forest Community Sch Corp,1413,1367,236,40,196,6,190,46,3,17,0,13,2019-08-01
4600,Merrillville Community School Corp,6955,6249,61,428,-367,278,-645,706,10,1,4,-9,2019-08-01
4615,Lake Central School Corporation,9637,9335,78,153,-75,149,-224,302,3,1,2,-2,2019-08-01
4645,Tri-Creek School Corporation,3333,3199,92,103,-11,31,-42,134,4,3,1,-1,2019-08-01
4650,Lake Ridge New Tech Schools,1887,1717,59,130,-71,40,-111,170,9,3,2,-6,2019-08-01
4660,Crown Point Community School Corp,8855,8568,0,154,-154,133,-287,287,3,0,2,-3,2019-08-01
4670,School City of East Chicago,5113,3594,89,1151,-1062,368,-1430,1519,30,2,7,-28,2019-08-01
4680,Lake Station Community Schools,1413,1138,57,211,-154,64,-218,275,19,4,5,-15,2019-08-01
4690,Gary Community School Corp,11782,4584,0,6638,-6638,560,-7198,7198,61,0,5,-61,2019-08-01
4700,Griffith Public Schools,2386,2220,123,113,10,53,-43,166,7,5,2,-2,2019-08-01
4710,School City of Hammond,14186,11907,509,1317,-808,962,-1770,2279,16,4,7,-12,2019-08-01
4720,School Town of Highland,3363,3192,59,86,-27,85,-112,171,5,2,3,-3,2019-08-01
4730,School City of Hobart,4174,3951,11,155,-144,68,-212,223,5,0,2,-5,2019-08-01
4740,School Town of Munster,3970,3914,186,27,159,29,130,56,1,5,1,3,2019-08-01
4760,School City of Whiting,924,831,346,67,279,26,253,93,10,37,3,27,2019-08-01
4805,New Prairie United School Corp,2566,2402,557,151,406,13,393,164,6,22,1,15,2019-08-01
4860,M S D of New Durham Township,782,637,228,138,90,7,83,145,19,29,1,11,2019-08-01
4915,Tri-Township Cons School Corp,490,284,76,204,-128,2,-130,206,42,16,0,-27,2019-08-01
4925,Michigan City Area Schools,6619,5431,0,800,-800,388,-1188,1188,18,0,6,-18,2019-08-01
4940,South Central Com School Corp,697,619,284,71,213,7,206,78,11,41,1,30,2019-08-01
4945,LaPorte Community School Corp,6351,5784,247,489,-242,78,-320,567,9,4,1,-5,2019-08-01
5075,North Lawrence Com Schools,4836,4503,124,263,-139,70,-209,333,7,3,1,-4,2019-08-01
5085,Mitchell Community Schools,1675,1493,31,179,-148,3,-151,182,11,2,0,-9,2019-08-01
5245,Frankton-Lapel Community Schools,2270,2191,834,65,769,14,755,79,3,37,1,33,2019-08-01
5255,South Madison Com Sch Corp,4100,3855,455,219,236,26,210,245,6,11,1,5,2019-08-01
5265,Alexandria Community School Corp,1507,1282,163,164,-1,61,-62,225,15,11,4,-4,2019-08-01
5275,Anderson Community School Corp,9980,6646,17,2619,-2602,715,-3317,3334,33,0,7,-33,2019-08-01
5280,Elwood Community School Corp,1561,1347,44,206,-162,8,-170,214,14,3,1,-11,2019-08-01
5300,M S D Decatur Township,7195,6332,315,653,-338,201,-539,854,12,4,3,-7,2019-08-01
5310,Franklin Township Com Sch Corp,10722,9539,105,692,-587,491,-1078,1183,11,1,5,-10,2019-08-01
5330,M S D Lawrence Township,16425,14289,1192,1401,-209,735,-944,2136,13,7,4,-6,2019-08-01
5340,Perry Township Schools,17804,15841,352,900,-548,1063,-1611,1963,11,2,6,-9,2019-08-01
5350,M S D Pike Township,12627,11085,0,958,-958,584,-1542,1542,12,0,5,-12,2019-08-01
5360,M S D Warren Township,14282,11724,0,1854,-1854,704,-2558,2558,18,0,5,-18,2019-08-01
5370,M S D Washington Township,11375,10159,814,674,140,542,-402,1216,11,7,5,-4,2019-08-01
5375,M S D Wayne Township,16691,15497,959,791,168,403,-235,1194,7,6,2,-1,2019-08-01
5380,Beech Grove City Schools,2214,1886,1078,198,880,130,750,328,15,49,6,34,2019-08-01
5385,Indianapolis Public Schools,46124,24713,665,17784,-17119,3627,-20746,21411,46,1,8,-45,2019-08-01
5400,School Town of Speedway,1998,1793,0,170,-170,35,-205,205,10,0,2,-10,2019-08-01
5455,Culver Community Schools Corp,927,664,92,252,-160,11,-171,263,28,10,1,-18,2019-08-01
5470,Argos Community Schools,645,494,110,145,-35,6,-41,151,23,17,1,-6,2019-08-01
5480,Bremen Public Schools,1335,1264,235,69,166,2,164,71,5,18,0,12,2019-08-01
5485,Plymouth Community School Corp,3380,3054,385,254,131,72,59,326,10,11,2,2,2019-08-01
5495,Triton School Corporation,859,771,129,87,42,1,41,88,10,15,0,5,2019-08-01
5520,Shoals Community School Corp,630,560,54,69,-15,1,-16,70,11,9,0,-3,2019-08-01
5525,Loogootee Community Sch Corp,864,712,109,152,-43,0,-43,152,18,13,0,-5,2019-08-01
5615,Maconaquah School Corp,2080,1789,269,280,-11,11,-22,291,14,13,1,-1,2019-08-01
5620,North Miami Community Schools,865,764,95,101,-6,0,-6,101,12,11,0,-1,2019-08-01
5625,Oak Hill United School Corp,1292,1204,473,73,400,15,385,88,7,37,1,30,2019-08-01
5635,Peru Community Schools,2070,1756,163,313,-150,1,-151,314,15,8,0,-7,2019-08-01
5705,Richland-Bean Blossom C S C,2708,2315,256,349,-93,44,-137,393,15,9,2,-5,2019-08-01
5740,Monroe County Community Sch Corp,11417,10463,288,732,-444,222,-666,954,8,3,2,-6,2019-08-01
5835,North Montgomery Com Sch Corp,1839,1638,138,195,-57,6,-63,201,11,8,0,-3,2019-08-01
5845,South Montgomery Com Sch Corp,1797,1573,89,219,-130,5,-135,224,12,5,0,-8,2019-08-01
5855,Crawfordsville Community Schools,2404,2196,248,208,40,0,40,208,9,10,0,2,2019-08-01
5900,Monroe-Gregg School District,1434,1265,234,130,104,38,66,168,12,16,3,5,2019-08-01
5910,Eminence Community School Corp,413,303,42,108,-66,2,-68,110,27,10,0,-16,2019-08-01
5925,M S D Martinsville Schools,4855,4211,95,464,-369,180,-549,644,13,2,4,-11,2019-08-01
5930,Mooresville Con School Corp,4152,3745,588,298,290,109,181,407,10,14,3,4,2019-08-01
5945,North Newton School Corp,1309,1190,23,104,-81,15,-96,119,9,2,1,-7,2019-08-01
5995,South Newton School Corp,847,793,23,52,-29,2,-31,54,6,3,0,-4,2019-08-01
6055,Central Noble Com School Corp,1203,1088,129,110,19,5,14,115,10,11,0,1,2019-08-01
6060,East Noble School Corporation,3696,3318,196,255,-59,123,-182,378,10,5,3,-5,2019-08-01
6065,West Noble School Corporation,2379,2164,100,210,-110,5,-115,215,9,4,0,-5,2019-08-01
6080,Rising Sun-Ohio Co Com,816,739,61,74,-13,3,-16,77,9,7,0,-2,2019-08-01
6145,Orleans Community Schools,783,717,128,66,62,0,62,66,8,16,0,8,2019-08-01
6155,Paoli Community School Corp,1424,1321,44,102,-58,1,-59,103,7,3,0,-4,2019-08-01
6160,Springs Valley Com School Corp,841,773,45,68,-23,0,-23,68,8,5,0,-3,2019-08-01
6195,Spencer-Owen Community Schools,2686,2275,83,386,-303,25,-328,411,15,3,1,-12,2019-08-01
6260,Southwest Parke Com Sch Corp,840,775,222,65,157,0,157,65,8,26,0,19,2019-08-01
6325,Perry Central Com Schools Corp,960,844,352,116,236,0,236,116,12,37,0,25,2019-08-01
6340,Cannelton City Schools,271,144,111,127,-16,0,-16,127,47,41,0,-6,2019-08-01
6350,Tell City-Troy Twp School Corp,1686,1262,122,424,-302,0,-302,424,25,7,0,-18,2019-08-01
6375,North Central Parke Comm Schl Corp,1204,1068,64,136,-72,0,-72,136,11,5,0,-6,2019-08-01
6445,Pike County School Corp,1852,1647,48,202,-154,3,-157,205,11,3,0,-8,2019-08-01
6460,M S D Boone Township,1038,982,156,46,110,10,100,56,5,15,1,10,2019-08-01
6470,Duneland School Corporation,5899,5439,334,422,-88,38,-126,460,8,6,1,-2,2019-08-01
6510,East Porter County School Corp,2374,2232,244,109,135,33,102,142,6,10,1,4,2019-08-01
6520,Porter Township School Corp,1384,1309,123,71,52,4,48,75,5,9,0,3,2019-08-01
6530,Union Township School Corp,1484,1404,46,73,-27,7,-34,80,5,3,0,-2,2019-08-01
6550,Portage Township Schools,8069,7343,32,561,-529,165,-694,726,9,0,2,-9,2019-08-01
6560,Valparaiso Community Schools,6701,6199,61,368,-307,134,-441,502,7,1,2,-7,2019-08-01
6590,M S D Mount Vernon,2067,1884,65,122,-57,61,-118,183,9,3,3,-6,2019-08-01
6600,M S D North Posey Co Schools,1418,1277,107,76,31,65,-34,141,10,8,5,-2,2019-08-01
6620,Eastern Pulaski Community Sch Corp,1051,996,190,55,135,0,135,55,5,18,0,13,2019-08-01
6630,West Central School Corp,744,690,63,50,13,4,9,54,7,8,1,1,2019-08-01
6705,South Putnam Community Schools,1073,931,133,142,-9,0,-9,142,13,12,0,-1,2019-08-01
6715,North Putnam Community Schools,1519,1308,37,210,-173,1,-174,211,14,2,0,-11,2019-08-01
6750,Cloverdale Community Schools,1080,981,94,98,-4,1,-5,99,9,9,0,-0,2019-08-01
6755,Greencastle Community School Corp,1844,1695,127,149,-22,0,-22,149,8,7,0,-1,2019-08-01
6795,Union School Corporation,363,164,2995,198,2797,1,2796,199,55,825,0,770,2019-08-01
6805,Randolph Southern School Corp,482,414,83,67,16,1,15,68,14,17,0,3,2019-08-01
6820,Monroe Central School Corp,950,856,214,94,120,0,120,94,10,23,0,13,2019-08-01
6825,Randolph Central School Corp,1430,1293,103,133,-30,4,-34,137,10,7,0,-2,2019-08-01
6835,Randolph Eastern School Corp,898,817,30,81,-51,0,-51,81,9,3,0,-6,2019-08-01
6865,South Ripley Com Sch Corp,1171,1025,100,126,-26,20,-46,146,12,9,2,-4,2019-08-01
6895,Batesville Community School Corp,2026,1866,265,73,192,87,105,160,8,13,4,5,2019-08-01
6900,Jac-Cen-Del Community Sch Corp,884,737,74,147,-73,0,-73,147,17,8,0,-8,2019-08-01
6910,Milan Community Schools,969,831,224,126,98,12,86,138,14,23,1,9,2019-08-01
6995,Rush County Schools,2218,1867,113,294,-181,57,-238,351,16,5,3,-11,2019-08-01
7150,John Glenn School Corporation,1643,1484,460,137,323,22,301,159,10,28,1,18,2019-08-01
7175,Penn-Harris-Madison School Corp,10230,9393,1710,549,1161,288,873,837,8,17,3,9,2019-08-01
7200,School City of Mishawaka,4685,3899,1191,550,641,236,405,786,17,25,5,9,2019-08-01
7205,South Bend Community School Corp,23333,16406,52,4338,-4286,2589,-6875,6927,30,0,11,-29,2019-08-01
7215,Union-North United School Corp,1133,849,392,277,115,7,108,284,25,35,1,10,2019-08-01
7230,Scott County School District 1,1329,1166,0,143,-143,20,-163,163,12,0,2,-12,2019-08-01
7255,Scott County School District 2,2498,2328,249,127,122,43,79,170,7,10,2,3,2019-08-01
7285,Shelby Eastern Schools,1266,973,130,280,-150,13,-163,293,23,10,1,-13,2019-08-01
7350,Northwestern Con School Corp,1277,1175,269,86,183,16,167,102,8,21,1,13,2019-08-01
7360,Southwestern Con Sch Shelby Co,617,498,91,115,-24,4,-28,119,19,15,1,-5,2019-08-01
7365,Shelbyville Central Schools,3952,3679,170,225,-55,48,-103,273,7,4,1,-3,2019-08-01
7385,North Spencer County Sch Corp,1979,1860,71,109,-38,10,-48,119,6,4,1,-2,2019-08-01
7445,South Spencer County Sch Corp,1237,1144,21,42,-21,51,-72,93,8,2,4,-6,2019-08-01
7495,Oregon-Davis School Corp,633,381,115,251,-136,1,-137,252,40,18,0,-22,2019-08-01
7515,North Judson-San Pierre Sch Corp,1246,951,38,237,-199,58,-257,295,24,3,5,-21,2019-08-01
7525,Knox Community School Corp,1765,1556,217,202,15,7,8,209,12,12,0,0,2019-08-01
7605,Fremont Community Schools,979,887,90,92,-2,0,-2,92,9,9,0,-0,2019-08-01
7610,Hamilton Community Schools,465,261,40,203,-163,1,-164,204,44,9,0,-35,2019-08-01
7615,M S D Steuben County,2648,2430,264,214,50,4,46,218,8,10,0,2,2019-08-01
7645,Northeast School Corp,1237,728,58,507,-449,2,-451,509,41,5,0,-36,2019-08-01
7715,Southwest School Corporation,1726,1503,193,223,-30,0,-30,223,13,11,0,-2,2019-08-01
7775,Switzerland County School Corp,1500,1393,39,95,-56,12,-68,107,7,3,1,-5,2019-08-01
7855,Lafayette School Corporation,8016,7336,313,227,86,453,-367,680,8,4,6,-5,2019-08-01
7865,Tippecanoe School Corp,14089,13009,213,683,-470,397,-867,1080,8,2,3,-6,2019-08-01
7875,West Lafayette Com School Corp,2289,2244,128,38,90,7,83,45,2,6,0,4,2019-08-01
7935,Tri-Central Community Schools,676,543,190,130,60,3,57,133,20,28,0,8,2019-08-01
7945,Tipton Community School Corp,1622,1436,85,186,-101,0,-101,186,11,5,0,-6,2019-08-01
7950,Union Co/Clg Corner Joint Sch Dist,1251,1199,87,52,35,0,35,52,4,7,0,3,2019-08-01
7995,Evansville Vanderburgh School Corp,24468,21737,121,1116,-995,1615,-2610,2731,11,0,7,-11,2019-08-01
8010,North Vermillion Com Sch Corp,713,666,87,45,42,2,40,47,7,12,0,6,2019-08-01
8020,South Vermillion Com Sch Corp,1750,1594,46,153,-107,3,-110,156,9,3,0,-6,2019-08-01
8030,Vigo County School Corp,14797,13991,80,650,-570,156,-726,806,5,1,1,-5,2019-08-01
8045,Manchester Community Schools,1503,1399,158,87,71,17,54,104,7,11,1,4,2019-08-01
8050,M S D Wabash County Schools,1834,1455,637,355,282,24,258,379,21,35,1,14,2019-08-01
8060,Wabash City Schools,1562,1195,323,351,-28,16,-44,367,23,21,1,-3,2019-08-01
8115,M S D Warren County,1382,1312,0,67,-67,3,-70,70,5,0,0,-5,2019-08-01
8130,Warrick County School Corp,10493,9906,185,351,-166,236,-402,587,6,2,2,-4,2019-08-01
8205,Salem Community Schools,1930,1660,148,268,-120,2,-122,270,14,8,0,-6,2019-08-01
8215,East Washington School Corp,1480,1273,96,206,-110,1,-111,207,14,6,0,-8,2019-08-01
8220,West Washington School Corp,783,673,188,109,79,1,78,110,14,24,0,10,2019-08-01
8305,Nettle Creek School Corporation,1001,883,214,114,100,4,96,118,12,21,0,10,2019-08-01
8355,Western Wayne Schools,905,781,77,120,-43,4,-47,124,14,9,0,-5,2019-08-01
8360,Centerville-Abington Com Schs,1452,1338,393,91,302,23,279,114,8,27,2,19,2019-08-01
8375,Northeastern Wayne Schools,943,866,425,68,357,9,348,77,8,45,1,37,2019-08-01
8385,Richmond Community Schools,5551,4417,120,875,-755,259,-1014,1134,20,2,5,-18,2019-08-01
8425,Southern Wells Com Schools,661,570,281,90,191,1,190,91,14,43,0,29,2019-08-01
8435,Northern Wells Community Schools,2399,2089,362,288,74,22,52,310,13,15,1,2,2019-08-01
8445,M S D Bluffton-Harrison,1501,1334,299,165,134,2,132,167,11,20,0,9,2019-08-01
8515,North White School Corp,1000,827,21,173,-152,0,-152,173,17,2,0,-15,2019-08-01
8525,Frontier School Corporation,649,569,83,76,7,4,3,80,12,13,1,0,2019-08-01
8535,Tri-County School Corporation,672,595,69,77,-8,0,-8,77,11,10,0,-1,2019-08-01
8565,Twin Lakes School Corp,2353,2239,128,103,25,11,14,114,5,5,0,1,2019-08-01
8625,Smith-Green Community Schools,1032,969,185,53,132,10,122,63,6,18,1,12,2019-08-01
8665,Whitley County Con Schools,3528,3315,151,156,-5,57,-62,213,6,4,2,-2,2019-08-01
0015,Adams Central Community Schools,1092,997,281,83,198,12,186,95,9,26,1,17,2018-08-01
0025,North Adams Community Schools,2093,1647,68,269,-201,177,-378,446,21,3,8,-18,2018-08-01
0035,South Adams Schools,1213,1124,76,86,-10,3,-13,89,7,6,0,-1,2018-08-01
0125,M S D Southwest Allen County Schls,7636,7280,60,113,-53,243,-296,356,5,1,3,-4,2018-08-01
0225,Northwest Allen County Schools,7973,7488,59,240,-181,245,-426,485,6,1,3,-5,2018-08-01
0235,Fort Wayne Community Schools,35199,28577,64,1902,-1838,4723,-6561,6625,19,0,13,-19,2018-08-01
0255,East Allen County Schools,10418,9062,617,353,264,1007,-743,1360,13,6,10,-7,2018-08-01
0365,Bartholomew Con School Corp,11779,10990,305,348,-43,442,-485,790,7,3,4,-4,2018-08-01
0370,Flat Rock-Hawcreek School Corp,870,776,108,84,24,10,14,94,11,12,1,2,2018-08-01
0395,Benton Community School Corp,1935,1795,36,81,-45,59,-104,140,7,2,3,-5,2018-08-01
0515,Blackford County Schools,1889,1636,29,252,-223,1,-224,253,13,2,0,-12,2018-08-01
0615,Western Boone Co Com Sch Dist,1637,1536,129,95,34,6,28,101,6,8,0,2,2018-08-01
0630,Zionsville Community Schools,6873,6756,36,80,-44,38,-82,118,2,1,1,-1,2018-08-01
0665,Lebanon Community School Corp,3699,3409,76,207,-131,85,-216,292,8,2,2,-6,2018-08-01
0670,Brown County School Corporation,2046,1847,33,173,-140,26,-166,199,10,2,1,-8,2018-08-01
0750,Carroll Consolidated School Corp,1072,995,86,70,16,7,9,77,7,8,1,1,2018-08-01
0755,Delphi Community School Corp,1527,1378,37,130,-93,19,-112,149,10,2,1,-7,2018-08-01
0775,Pioneer Regional School Corp,1005,913,44,92,-48,0,-48,92,9,4,0,-5,2018-08-01
0815,Lewis Cass Schools,1342,1124,187,214,-27,4,-31,218,16,14,0,-2,2018-08-01
0875,Logansport Community Sch Corp,4225,3980,180,248,-68,1,-69,249,6,4,0,-2,2018-08-01
0940,West Clark Community Schools,5023,4304,372,574,-202,146,-348,720,14,7,3,-7,2018-08-01
1000,Clarksville Community School Corp,1530,1111,259,341,-82,78,-160,419,27,17,5,-10,2018-08-01
1010,Greater Clark County Schools,11351,9887,229,1161,-932,305,-1237,1466,13,2,3,-11,2018-08-01
1125,Clay Community Schools,4095,3931,184,156,28,8,20,164,4,4,0,0,2018-08-01
1150,Clinton Central School Corporation,985,892,0,87,-87,6,-93,93,9,0,1,-9,2018-08-01
1160,Clinton Prairie School Corporation,1271,1204,3,52,-49,15,-64,67,5,0,1,-5,2018-08-01
1170,Community Schools of Frankfort,3123,3014,57,89,-32,22,-54,111,4,2,1,-2,2018-08-01
1180,Rossville Con School District,890,844,137,33,104,13,91,46,5,15,1,10,2018-08-01
1300,Crawford County Community Sch Corp,1595,1461,3,133,-130,1,-131,134,8,0,0,-8,2018-08-01
1315,Barr-Reeve Community Schools Inc,685,674,178,9,169,2,167,11,2,26,0,24,2018-08-01
1375,North Daviess Com Schools,1066,1033,177,29,148,4,144,33,3,17,0,14,2018-08-01
